[
  {
    "id": "then-now-philippopolis-street-1878",
    "place_id": "place-old-town",
    "historical_archive_item_id": "archive-photo-philippopolis-street-1878",
    "title_bg": "Улица във Филипопол през януари 1878 г. — тогава/сега",
    "title_en": "Street in Philippopolis, January 1878 — then/now",
    "caption_bg": "Сравнение между архивния кадър „Улица във Филипопол през януари 1878 г.“ и съвременен свободно лицензиран образ на Старият град (Старинен Пловдив).",
    "caption_en": "Comparison between the archive image “Street in Philippopolis, January 1878” and a modern open-licensed image of The Old Town (Old Plovdiv).",
    "then_media": {
      "type": "image",
      "title": "0530 Вид на одну из улиц Филиппополя (Пловдива), январь 1878.jpg",
      "url": "https://upload.wikimedia.org/wikipedia/commons/b/b3/0530_%D0%92%D0%B8%D0%B4_%D0%BD%D0%B0_%D0%BE%D0%B4%D0%BD%D1%83_%D0%B8%D0%B7_%D1%83%D0%BB%D0%B8%D1%86_%D0%A4%D0%B8%D0%BB%D0%B8%D0%BF%D0%BF%D0%BE%D0%BF%D0%BE%D0%BB%D1%8F_%28%D0%9F%D0%BB%D0%BE%D0%B2%D0%B4%D0%B8%D0%B2%D0%B0%29%2C_%D1%8F%D0%BD%D0%B2%D0%B0%D1%80%D1%8C_1878.jpg",
      "page_url": "https://commons.wikimedia.org/wiki/File:0530_%D0%92%D0%B8%D0%B4_%D0%BD%D0%B0_%D0%BE%D0%B4%D0%BD%D1%83_%D0%B8%D0%B7_%D1%83%D0%BB%D0%B8%D1%86_%D0%A4%D0%B8%D0%BB%D0%B8%D0%BF%D0%BF%D0%BE%D0%BF%D0%BE%D0%BB%D1%8F_(%D0%9F%D0%BB%D0%BE%D0%B2%D0%B4%D0%B8%D0%B2%D0%B0)%2C_%D1%8F%D0%BD%D0%B2%D0%B0%D1%80%D1%8C_1878.jpg",
      "credit": "Unknown author",
      "license": "Public domain",
      "license_url": "https://commons.wikimedia.org/wiki/Commons:Licensing",
      "accessed_at": "2026-06-19"
    },
    "now_media": {
      "type": "image",
      "title": "Renovated house in plovdiv old town.jpg",
      "url": "https://upload.wikimedia.org/wikipedia/commons/b/bb/Renovated_house_in_plovdiv_old_town.jpg",
      "page_url": "https://commons.wikimedia.org/wiki/File:Renovated_house_in_plovdiv_old_town.jpg",
      "credit": "Faces&&Places",
      "license": "CC BY 2.0",
      "license_url": "https://creativecommons.org/licenses/by/2.0",
      "accessed_at": "2026-06-19"
    },
    "match_quality": "same_place_approximate_viewpoint",
    "data_quality": "public_source",
    "editorial": {
      "status": "needs_editorial_signoff",
      "reviewed_by": null,
      "reviewed_at": null,
      "notes_bg": "Автоматично подготвена двойка тогава/сега; изисква независима редакторска проверка на съвпадението, лиценза и контекста преди финално публикуване.",
      "notes_en": "Automatically prepared then/now pair; requires independent editorial review of the match, license and context before final publication."
    }
  },
  {
    "id": "then-now-plovdiv-station-around-1880",
    "place_id": "place-plovdiv-central-railway-station-q7205164",
    "historical_archive_item_id": "archive-photo-plovdiv-station-around-1880",
    "title_bg": "Железопътната гара на Пловдив около 1880 г. — тогава/сега",
    "title_en": "Plovdiv railway station around 1880 — then/now",
    "caption_bg": "Сравнение между архивния кадър „Железопътната гара на Пловдив около 1880 г.“ и съвременен свободно лицензиран образ на Централна гара Пловдив.",
    "caption_en": "Comparison between the archive image “Plovdiv railway station around 1880” and a modern open-licensed image of Plovdiv Central railway station.",
    "then_media": {
      "type": "image",
      "title": "Plovdiv Train Station Around 1880.jpg",
      "url": "https://upload.wikimedia.org/wikipedia/commons/6/61/Plovdiv_Train_Station_Around_1880.jpg",
      "page_url": "https://commons.wikimedia.org/wiki/File:Plovdiv_Train_Station_Around_1880.jpg",
      "credit": "Dimitar Kavra",
      "license": "Public domain",
      "license_url": "https://commons.wikimedia.org/wiki/Commons:Licensing",
      "accessed_at": "2026-06-19"
    },
    "now_media": {
      "type": "image",
      "title": "Plovdiv train station 2021 from train window.jpg",
      "url": "https://upload.wikimedia.org/wikipedia/commons/f/f4/Plovdiv_train_station_2021_from_train_window.jpg",
      "page_url": "https://commons.wikimedia.org/wiki/File:Plovdiv_train_station_2021_from_train_window.jpg",
      "credit": "Sharon Hahn Darlin",
      "license": "CC BY 2.0",
      "license_url": "https://creativecommons.org/licenses/by/2.0/",
      "accessed_at": "2026-07-09"
    },
    "match_quality": "same_place_approximate_viewpoint",
    "data_quality": "public_source",
    "editorial": {
      "status": "needs_editorial_signoff",
      "reviewed_by": null,
      "reviewed_at": null,
      "notes_bg": "Автоматично подготвена двойка тогава/сега; изисква независима редакторска проверка на съвпадението, лиценза и контекста преди финално публикуване.",
      "notes_en": "Automatically prepared then/now pair; requires independent editorial review of the match, license and context before final publication."
    }
  },
  {
    "id": "then-now-bahnhof-von-plowdiw",
    "place_id": "place-plovdiv-central-railway-station-q7205164",
    "historical_archive_item_id": "archive-postcard-bahnhof-von-plowdiw",
    "title_bg": "Пощенска картичка „Bahnhof von Plowdiw“ — тогава/сега",
    "title_en": "Postcard: Bahnhof von Plowdiw — then/now",
    "caption_bg": "Сравнение между архивния кадър „Пощенска картичка „Bahnhof von Plowdiw““ и съвременен свободно лицензиран образ на Централна гара Пловдив.",
    "caption_en": "Comparison between the archive image “Postcard: Bahnhof von Plowdiw” and a modern open-licensed image of Plovdiv Central railway station.",
    "then_media": {
      "type": "image",
      "title": "Bahnhof von Plowdiw.jpg",
      "url": "https://upload.wikimedia.org/wikipedia/commons/4/43/Bahnhof_von_Plowdiw.jpg",
      "page_url": "https://commons.wikimedia.org/wiki/File:Bahnhof_von_Plowdiw.jpg",
      "credit": "Unknown author",
      "license": "Public domain",
      "license_url": "https://commons.wikimedia.org/wiki/Commons:Licensing",
      "accessed_at": "2026-06-19"
    },
    "now_media": {
      "type": "image",
      "title": "Plovdiv train station 2021 from train window.jpg",
      "url": "https://upload.wikimedia.org/wikipedia/commons/f/f4/Plovdiv_train_station_2021_from_train_window.jpg",
      "page_url": "https://commons.wikimedia.org/wiki/File:Plovdiv_train_station_2021_from_train_window.jpg",
      "credit": "Sharon Hahn Darlin",
      "license": "CC BY 2.0",
      "license_url": "https://creativecommons.org/licenses/by/2.0/",
      "accessed_at": "2026-07-09"
    },
    "match_quality": "same_place_approximate_viewpoint",
    "data_quality": "public_source",
    "editorial": {
      "status": "needs_editorial_signoff",
      "reviewed_by": null,
      "reviewed_at": null,
      "notes_bg": "Автоматично подготвена двойка тогава/сега; изисква независима редакторска проверка на съвпадението, лиценза и контекста преди финално публикуване.",
      "notes_en": "Automatically prepared then/now pair; requires independent editorial review of the match, license and context before final publication."
    }
  },
  {
    "id": "then-now-plovdiv-karastoyanov-c1908",
    "place_id": "place-plovdiv-city",
    "historical_archive_item_id": "archive-photo-plovdiv-karastoyanov-c1908",
    "title_bg": "Пловдив във фотография на Иван Карастоянов — тогава/сега",
    "title_en": "Plovdiv photographed by Ivan Karastoyanov — then/now",
    "caption_bg": "Сравнение между архивния кадър „Пловдив във фотография на Иван Карастоянов“ и съвременен свободно лицензиран образ на Пловдив.",
    "caption_en": "Comparison between the archive image “Plovdiv photographed by Ivan Karastoyanov” and a modern open-licensed image of Plovdiv.",
    "then_media": {
      "type": "image",
      "title": "Plovdiv Ivan Karastoyanov.jpg",
      "url": "https://upload.wikimedia.org/wikipedia/commons/3/3a/Plovdiv_Ivan_Karastoyanov.jpg",
      "page_url": "https://commons.wikimedia.org/wiki/File:Plovdiv_Ivan_Karastoyanov.jpg",
      "credit": "Ivan Karastoyanov",
      "license": "Public domain",
      "license_url": "https://commons.wikimedia.org/wiki/Commons:Licensing",
      "accessed_at": "2026-06-19"
    },
    "now_media": {
      "type": "image",
      "title": "View from Nebet Tepe (54118748660).jpg",
      "url": "https://upload.wikimedia.org/wikipedia/commons/c/c0/View_from_Nebet_Tepe_%2854118748660%29.jpg",
      "page_url": "https://commons.wikimedia.org/wiki/File:View_from_Nebet_Tepe_(54118748660).jpg",
      "credit": "Jocelyn Erskine-Kellie from London, UK",
      "license": "CC BY-SA 2.0",
      "license_url": "https://creativecommons.org/licenses/by-sa/2.0/",
      "accessed_at": "2026-07-09"
    },
    "match_quality": "city_context",
    "data_quality": "public_source",
    "editorial": {
      "status": "needs_editorial_signoff",
      "reviewed_by": null,
      "reviewed_at": null,
      "notes_bg": "Автоматично подготвена двойка тогава/сега; изисква независима редакторска проверка на съвпадението, лиценза и контекста преди финално публикуване.",
      "notes_en": "Automatically prepared then/now pair; requires independent editorial review of the match, license and context before final publication."
    }
  },
  {
    "id": "then-now-dzhambaztepe-1892",
    "place_id": "place-dzhambaz-hill-in-plovdiv-q12277962",
    "historical_archive_item_id": "archive-photo-dzhambaztepe-1892",
    "title_bg": "Джамбаз тепе през 1892 г. — тогава/сега",
    "title_en": "Dzhambaz Tepe in 1892 — then/now",
    "caption_bg": "Сравнение между архивния кадър „Джамбаз тепе през 1892 г.“ и съвременен свободно лицензиран образ на Джамбаз тепе.",
    "caption_en": "Comparison between the archive image “Dzhambaz Tepe in 1892” and a modern open-licensed image of Dzhambaz hill in Plovdiv.",
    "then_media": {
      "type": "image",
      "title": "Dzhambaztepe 1892.jpg",
      "url": "https://upload.wikimedia.org/wikipedia/commons/9/9f/Dzhambaztepe_1892.jpg",
      "page_url": "https://commons.wikimedia.org/wiki/File:Dzhambaztepe_1892.jpg",
      "credit": "Ivan Karastoyanov",